283, Surskit, , Pond Skater, Bug, Water, Swift Swim, , Rain Dish, 0.5, 1.7, 200, 70, 54, 50, 15, Medium Fast, Bug, Water 1, 40, 30, 32, 50, 52, 65
284, Masquerain, , Eyeball, Bug, Flying, Intimidate, , Unnerve, 0.8, 3.6, 75, 70, 159, 50, 15, Medium Fast, Bug, Water 1, 70, 60, 62, 100, 82, 80
285, Shroomish, , Mushroom, Grass, , Effect Spore, Poison Heal, Quick Feet, 0.4, 4.5, 255, 70, 59, 50, 15, Fluctuating, Fairy, Grass, 60, 40, 60, 40, 60, 35
286, Breloom, , Mushroom, Grass, Fighting, Effect Spore, Poison Heal, Technician, 1.2, 39.2, 90, 70, 161, 50, 15, Fluctuating, Fairy, Grass, 60, 130, 80, 60, 60, 70
287, Slakoth, , Slacker, Normal, , Truant, , , 0.8, 24, 255, 70, 56, 50, 15, Slow, Field, , 60, 60, 60, 35, 35, 30
288, Vigoroth, , Wild Monkey, Normal, , Vital Spirit, , , 1.4, 46.5, 120, 70, 154, 50, 15, Slow, Field, , 80, 80, 80, 55, 55, 90
289, Slaking, , Lazy, Normal, , Truant, , , 2, 130.5, 45, 70, 252, 50, 15, Slow, Field, , 150, 160, 100, 95, 65, 100
290, Nincada, , Trainee, Bug, Ground, Compound Eyes, , Run Away, 0.5, 5.5, 255, 70, 53, 50, 15, Erratic, Bug, , 31, 45, 90, 30, 30, 40
291, Ninjask, , Ninja, Bug, Flying, Speed Boost, , Infiltrator, 0.8, 12, 120, 70, 160, 50, 15, Erratic, Bug, , 61, 90, 45, 50, 50, 160
292, Shedinja, , Shed, Bug, Ghost, Wonder Guard, , , 0.8, 1.2, 45, 70, 83, , 15, Erratic, Mineral, , 1, 90, 45, 30, 30, 40
293, Whismur, , Whisper, Normal, , Soundproof, , Rattled, 0.6, 16.3, 190, 70, 48, 50, 20, Medium Slow, Field, Monster, 64, 51, 23, 51, 23, 28
294, Loudred, , Big Voice, Normal, , Soundproof, , Scrappy, 1, 40.5, 120, 70, 126, 50, 20, Medium Slow, Field, Monster, 84, 71, 43, 71, 43, 48
295, Exploud, , Loud Noise, Normal, , Soundproof, , Scrappy, 1.5, 84, 45, 70, 221, 50, 20, Medium Slow, Field, Monster, 104, 91, 63, 91, 73, 68
296, Makuhita, , Guts, Fighting, , Thick Fat, Guts, Sheer Force, 1, 86.4, 180, 70, 47, 75, 20, Fluctuating, Human-Like, , 72, 60, 30, 20, 30, 25
297, Hariyama, , Arm Thrust, Fighting, , Thick Fat, Guts, Sheer Force, 2.3, 253.8, 200, 70, 166, 75, 20, Fluctuating, Human-Like, , 144, 120, 60, 40, 60, 50
298, Azurill, , Polka Dot, Normal, Fairy, Thick Fat, Huge Power, Sap Sipper, 0.2, 2, 150, 70, 38, 25, 10, Fast, Undiscovered, , 50, 20, 40, 20, 40, 20
299, Nosepass, , Compass, Rock, , Sturdy, Magnet Pull, Sand Force, 1, 97, 255, 70, 75, 50, 20, Medium Fast, Mineral, , 30, 45, 135, 45, 90, 30
300, Skitty, , Kitten, Normal, , Cute Charm, Normalize, Wonder Skin, 0.6, 11, 255, 70, 52, 25, 15, Fast, Fairy, Field, 50, 45, 45, 35, 35, 50
301, Delcatty, , Prim, Normal, , Cute Charm, Normalize, Wonder Skin, 1.1, 32.6, 60, 70, 140, 25, 15, Fast, Fairy, Field, 70, 65, 65, 55, 55, 90
302, Sableye, , Darkness, Dark, Ghost, Keen Eye, Stall, Prankster, 0.5, 11, 45, 35, 133, 50, 25, Medium Slow, Human-Like, , 50, 75, 75, 65, 65, 50
302, Mega Sableye, m, Darkness, Dark, Ghost, Magic Bounce, , , 0.5, 161, 45, 35, 168, 50, 25, Medium Slow, Human-Like, , 50, 85, 125, 85, 115, 20
303, Mawile, , Deceiver, Steel, Fairy, Hyper Cutter, Intimidate, Sheer Force, 0.6, 11.5, 45, 70, 133, 50, 20, Fast, Fairy, Field, 50, 85, 85, 55, 55, 50
303, Mega Mawile, m, Deceiver, Steel, Fairy, Huge Power, , , 1, 23.5, 45, 70, 168, 50, 20, Fast, Fairy, Field, 50, 105, 125, 55, 95, 50
304, Aron, , Iron Armor, Steel, Rock, Sturdy, Rock Head, Heavy Metal, 0.4, 60, 180, 35, 66, 50, 35, Slow, Monster, , 50, 70, 100, 40, 40, 30
305, Lairon, , Iron Armor, Steel, Rock, Sturdy, Rock Head, Heavy Metal, 0.9, 120, 90, 35, 151, 50, 35, Slow, Monster, , 60, 90, 140, 50, 50, 40
306, Aggron, , Iron Armor, Steel, Rock, Sturdy, Rock Head, Heavy Metal, 2.1, 360, 45, 35, 239, 50, 35, Slow, Monster, , 70, 110, 180, 60, 60, 50
306, Mega Aggron, m, Iron Armor, Steel, , Filter, , , 2.2, 395, 45, 35, 284, 50, 35, Slow, Monster, , 70, 140, 230, 60, 80, 50
307, Meditite, , Meditate, Fighting, Psychic, Pure Power, , Telepathy, 0.6, 11.2, 180, 70, 56, 50, 20, Medium Fast, Human-Like, , 30, 40, 55, 40, 55, 60
308, Medicham, , Meditate, Fighting, Psychic, Pure Power, , Telepathy, 1.3, 31.5, 90, 70, 144, 50, 20, Medium Fast, Human-Like, , 60, 60, 75, 60, 75, 80
308, Mega Medicham, m, Meditate, Fighting, Psychic, Pure Power, , , 1.3, 31.5, 90, 70, 179, 50, 20, Medium Fast, Human-Like, , 60, 100, 85, 80, 85, 100
309, Electrike, , Lightning, Electric, , Static, Lightning Rod, Minus, 0.6, 15.2, 120, 70, 59, 50, 20, Slow, Field, , 40, 45, 40, 65, 40, 65
310, Manectric, , Discharge, Electric, , Static, Lightning Rod, Minus, 1.5, 40.2, 45, 70, 166, 50, 20, Slow, Field, , 70, 75, 60, 105, 60, 105
310, Mega Manectric, m, Discharge, Electric, , Intimidate, , , 1.8, 44, 45, 70, 201, 50, 20, Slow, Field, , 70, 75, 80, 135, 80, 135
311, Plusle, , Cheering, Electric, , Plus, , Lightning Rod, 0.4, 4.2, 200, 70, 142, 50, 20, Medium Fast, Fairy, , 60, 50, 40, 85, 75, 95
312, Minun, , Cheering, Electric, , Minus, , Volt Absorb, 0.4, 4.2, 200, 70, 142, 50, 20, Medium Fast, Fairy, , 60, 40, 50, 75, 85, 95
313, Volbeat, , Firefly, Bug, , Illuminate, Swarm, Prankster, 0.7, 17.7, 150, 70, 151, 100, 15, Erratic, Bug, Human-Like, 65, 73, 75, 47, 85, 85
314, Illumise, , Firefly, Bug, , Oblivious, Tinted Lens, Prankster, 0.6, 17.7, 150, 70, 151, 0, 15, Fluctuating, Bug, Human-Like, 65, 47, 75, 73, 85, 85
315, Roselia, , Thorn, Grass, Poison, Natural Cure, Poison Point, Leaf Guard, 0.3, 2, 150, 70, 140, 50, 20, Medium Slow, Fairy, Grass, 50, 60, 45, 100, 80, 65
316, Gulpin, , Stomach, Poison, , Liquid Ooze, Sticky Hold, Gluttony, 0.4, 10.3, 225, 70, 60, 50, 20, Fluctuating, Amorphous, , 70, 43, 53, 43, 53, 40
317, Swalot, , Poison Bag, Poison, , Liquid Ooze, Sticky Hold, Gluttony, 1.7, 80, 75, 70, 163, 50, 20, Fluctuating, Amorphous, , 100, 73, 83, 73, 83, 55
318, Carvanha, , Savage, Water, Dark, Rough Skin, , Speed Boost, 0.8, 20.8, 225, 35, 61, 50, 20, Slow, Water 2, , 45, 90, 20, 65, 20, 65
319, Sharpedo, , Brutal, Water, Dark, Rough Skin, , Speed Boost, 1.8, 88.8, 60, 35, 161, 50, 20, Slow, Water 2, , 70, 120, 40, 95, 40, 95
319, Mega Sharpedo, m, Brutal, Water, Dark, Strong Jaw, , , 2.5, 130.3, 60, 35, 196, 50, 20, Slow, Water 2, , 70, 140, 70, 110, 65, 105
320, Wailmer, , Ball Whale, Water, , Water Veil, Oblivious, Pressure, 2, 130, 125, 70, 80, 50, 40, Fluctuating, Field, Water 2, 130, 70, 35, 70, 35, 60
321, Wailord, , Float Whale, Water, , Water Veil, Oblivious, Pressure, 14.5, 398, 60, 70, 175, 50, 40, Fluctuating, Field, Water 2, 170, 90, 45, 90, 45, 60
322, Numel, , Numb, Fire, Ground, Oblivious, Simple, Own Tempo, 0.7, 24, 255, 70, 61, 50, 20, Medium Fast, Field, , 60, 60, 40, 65, 45, 35
323, Camerupt, , Eruption, Fire, Ground, Magma Armor, Solid Rock, Anger Point, 1.9, 220, 150, 70, 161, 50, 20, Medium Fast, Field, , 70, 100, 70, 105, 75, 40
323, Mega Camerupt, m, Eruption, Fire, Ground, Sheer Force, , , 2.5, 320.5, 150, 70, 196, 50, 20, Medium Fast, Field, , 70, 120, 100, 145, 105, 20
324, Torkoal, , Coal, Fire, , White Smoke, Drought, Shell Armor, 0.5, 80.4, 90, 70, 165, 50, 20, Medium Fast, Field, , 70, 85, 140, 85, 70, 20
325, Spoink, , Bounce, Psychic, , Thick Fat, Own Tempo, Gluttony, 0.7, 30.6, 255, 70, 66, 50, 20, Fast, Field, , 60, 25, 35, 70, 80, 60
326, Grumpig, , Manipulate, Psychic, , Thick Fat, Own Tempo, Gluttony, 0.9, 71.5, 60, 70, 165, 50, 20, Fast, Field, , 80, 45, 65, 90, 110, 80
327, Spinda, , Spot Panda, Normal, , Own Tempo, Tangled Feet, Contrary, 1.1, 5, 255, 70, 126, 50, 15, Fast, Field, Human-Like, 60, 60, 60, 60, 60, 60
328, Trapinch, , Ant Pit, Ground, , Hyper Cutter, Arena Trap, Sheer Force, 0.7, 15, 255, 70, 58, 50, 20, Medium Slow, Bug, Dragon, 45, 100, 45, 45, 45, 10
329, Vibrava, , Vibration, Ground, Dragon, Levitate, , , 1.1, 15.3, 120, 70, 119, 50, 20, Medium Slow, Bug, Dragon, 50, 70, 50, 50, 50, 70
330, Flygon, , Mystic, Ground, Dragon, Levitate, , , 2, 82, 45, 70, 234, 50, 20, Medium Slow, Bug, Dragon, 80, 100, 80, 80, 80, 100
331, Cacnea, , Cactus, Grass, , Sand Veil, , Water Absorb, 0.4, 51.3, 190, 35, 67, 50, 20, Medium Slow, Grass, Human-Like, 50, 85, 40, 85, 40, 35
332, Cacturne, , Scarecrow, Grass, Dark, Sand Veil, , Water Absorb, 1.3, 77.4, 60, 35, 166, 50, 20, Medium Slow, Grass, Human-Like, 70, 115, 60, 115, 60, 55
333, Swablu, , Cotton Bird, Normal, Flying, Natural Cure, , Cloud Nine, 0.4, 1.2, 255, 70, 62, 50, 20, Erratic, Dragon, Flying, 45, 40, 60, 40, 75, 50
334, Altaria, , Humming, Dragon, Flying, Natural Cure, , Cloud Nine, 1.1, 20.6, 45, 70, 172, 50, 20, Erratic, Dragon, Flying, 75, 70, 90, 70, 105, 80
334, Mega Altaria, m, Humming, Dragon, Fairy, Pixilate, , , 1.5, 20.6, 45, 70, 207, 50, 20, Erratic, Dragon, Flying, 75, 110, 110, 110, 105, 80
335, Zangoose, , Cat Ferret, Normal, , Immunity, , Toxic Boost, 1.3, 40.3, 90, 70, 160, 50, 20, Erratic, Field, , 73, 115, 60, 60, 60, 90
336, Seviper, , Fang Snake, Poison, , Shed Skin, , Infiltrator, 2.7, 52.5, 90, 70, 160, 50, 20, Fluctuating, Dragon, Field, 73, 100, 60, 100, 60, 65
337, Lunatone, , Meteorite, Rock, Psychic, Levitate, , , 1, 168, 45, 70, 161, , 25, Fast, Mineral, , 90, 55, 65, 95, 85, 70
338, Solrock, , Meteorite, Rock, Psychic, Levitate, , , 1.2, 154, 45, 70, 161, , 25, Fast, Mineral, , 90, 95, 85, 55, 65, 70
339, Barboach, , Whiskers, Water, Ground, Oblivious, Anticipation, Hydration, 0.4, 1.9, 190, 70, 58, 50, 20, Medium Fast, Water 2, , 50, 48, 43, 46, 41, 60
340, Whiscash, , Whiskers, Water, Ground, Oblivious, Anticipation, Hydration, 0.9, 23.6, 75, 70, 164, 50, 20, Medium Fast, Water 2, , 110, 78, 73, 76, 71, 60
341, Corphish, , Ruffian, Water, , Hyper Cutter, Shell Armor, Adaptability, 0.6, 11.5, 205, 70, 62, 50, 15, Fluctuating, Water 1, Water 3, 43, 80, 65, 50, 35, 35
342, Crawdaunt, , Rogue, Water, Dark, Hyper Cutter, Shell Armor, Adaptability, 1.1, 32.8, 155, 70, 164, 50, 15, Fluctuating, Water 1, Water 3, 63, 120, 85, 90, 55, 55
343, Baltoy, , Clay Doll, Ground, Psychic, Levitate, , , 0.5, 21.5, 255, 70, 60, , 20, Medium Fast, Mineral, , 40, 40, 55, 40, 70, 55
344, Claydol, , Clay Doll, Ground, Psychic, Levitate, , , 1.5, 108, 90, 70, 175, , 20, Medium Fast, Mineral, , 60, 70, 105, 70, 120, 75
345, Lileep, , Sea Lily, Rock, Grass, Suction Cups, , Storm Drain, 1, 23.8, 45, 70, 71, 87.5, 30, Erratic, Water 3, , 66, 41, 77, 61, 87, 23
346, Cradily, , Barnacle, Rock, Grass, Suction Cups, , Storm Drain, 1.5, 60.4, 45, 70, 173, 87.5, 30, Erratic, Water 3, , 86, 81, 97, 81, 107, 43
347, Anorith, , Old Shrimp, Rock, Bug, Battle Armor, , Swift Swim, 0.7, 12.5, 45, 70, 71, 87.5, 30, Erratic, Water 3, , 45, 95, 50, 40, 50, 75
348, Armaldo, , Plate, Rock, Bug, Battle Armor, , Swift Swim, 1.5, 68.2, 45, 70, 173, 87.5, 30, Erratic, Water 3, , 75, 125, 100, 70, 80, 45
349, Feebas, , Fish, Water, , Swift Swim, Oblivious, Adaptability, 0.6, 7.4, 255, 70, 40, 50, 20, Erratic, Dragon, Water 1, 20, 15, 20, 10, 55, 80
350, Milotic, , Tender, Water, , Marvel Scale, Competitive, Cute Charm, 6.2, 162, 60, 70, 189, 50, 20, Erratic, Dragon, Water 1, 95, 60, 79, 100, 125, 81
351, Castform, , Weather, Normal, , Forecast, , , 0.3, 0.8, 45, 70, 147, 50, 25, Medium Fast, Amorphous, Fairy, 70, 70, 70, 70, 70, 70
351, Castform Sunny Form, s, Weather, Fire, , Forecast, , , 0.3, 0.8, 45, 70, 147, 50, 25, Medium Fast, Amorphous, Fairy, 70, 70, 70, 70, 70, 70
351, Castform Rainy Form, r, Weather, Water, , Forecast, , , 0.3, 0.8, 45, 70, 147, 50, 25, Medium Fast, Amorphous, Fairy, 70, 70, 70, 70, 70, 70
351, Castform Snowy Form, i, Weather, Ice, , Forecast, , , 0.3, 0.8, 45, 70, 147, 50, 25, Medium Fast, Amorphous, Fairy, 70, 70, 70, 70, 70, 70
352, Kecleon, , Color Swap, Normal, , Color Change, , Protean, 1, 22, 200, 70, 154, 50, 20, Medium Slow, Field, , 60, 90, 70, 60, 120, 40
353, Shuppet, , Puppet, Ghost, , Insomnia, Frisk, Cursed Body, 0.6, 2.3, 225, 35, 59, 50, 25, Fast, Amorphous, , 44, 75, 35, 63, 33, 45
354, Banette, , Marionette, Ghost, , Insomnia, Frisk, Cursed Body, 1.1, 12.5, 45, 35, 159, 50, 25, Fast, Amorphous, , 64, 115, 65, 83, 63, 65
354, Mega Banette, m, Marionette, Ghost, , Prankster, , , 1.2, 13, 45, 35, 194, 50, 25, Fast, Amorphous, , 64, 165, 75, 93, 83, 75
355, Duskull, , Requiem, Ghost, , Levitate, , Frisk, 0.8, 15, 190, 35, 59, 50, 25, Fast, Amorphous, , 20, 40, 90, 30, 90, 25
356, Dusclops, , Beckon, Ghost, , Pressure, , Frisk, 1.6, 30.6, 90, 35, 159, 50, 25, Fast, Amorphous, , 40, 70, 130, 60, 130, 25
357, Tropius, , Fruit, Grass, Flying, Chlorophyll, Solar Power, Harvest, 2, 100, 200, 70, 161, 50, 25, Slow, Grass, Monster, 99, 68, 83, 72, 87, 51
358, Chimecho, , Wind Chime, Psychic, , Levitate, , , 0.6, 1, 45, 70, 159, 50, 25, Fast, Amorphous, , 75, 50, 80, 95, 90, 65
359, Absol, , Disaster, Dark, , Pressure, Super Luck, Justified, 1.2, 47, 30, 35, 163, 50, 25, Medium Slow, Field, , 65, 130, 60, 75, 60, 75
359, Mega Absol, m, Disaster, Dark, , Magic Bounce, , , 1.2, 49, 30, 35, 198, 50, 25, Medium Slow, Field, , 65, 150, 60, 115, 60, 115
360, Wynaut, , Bright, Psychic, , Shadow Tag, , Telepathy, 0.6, 14, 125, 70, 52, 50, 20, Medium Fast, Undiscovered, , 95, 23, 48, 23, 48, 23
361, Snorunt, , Snow Hat, Ice, , Inner Focus, Ice Body, Moody, 0.7, 16.8, 190, 70, 60, 50, 20, Medium Fast, Fairy, Mineral, 50, 50, 50, 50, 50, 50
362, Glalie, , Face, Ice, , Inner Focus, Ice Body, Moody, 1.5, 256.5, 75, 70, 168, 50, 20, Medium Fast, Fairy, Mineral, 80, 80, 80, 80, 80, 80
362, Mega Glalie, m, Face, Ice, , Refrigerate, , , 2.1, 350.2, 75, 70, 203, 50, 20, Medium Fast, Fairy, Mineral, 80, 120, 80, 120, 80, 100
363, Spheal, , Clap, Ice, Water, Thick Fat, Ice Body, Oblivious, 0.8, 39.5, 255, 70, 58, 50, 20, Medium Slow, Field, Water 1, 70, 40, 50, 55, 50, 25
364, Sealeo, , Ball Roll, Ice, Water, Thick Fat, Ice Body, Oblivious, 1.1, 87.6, 120, 70, 144, 50, 20, Medium Slow, Field, Water 1, 90, 60, 70, 75, 70, 45
365, Walrein, , Ice Break, Ice, Water, Thick Fat, Ice Body, Oblivious, 1.4, 150.6, 45, 70, 239, 50, 20, Medium Slow, Field, Water 1, 110, 80, 90, 95, 90, 65
366, Clamperl, , Bivalve, Water, , Shell Armor, , Rattled, 0.4, 52.5, 255, 70, 69, 50, 20, Erratic, Water 1, , 35, 64, 85, 74, 55, 32
367, Huntail, , Deep Sea, Water, , Swift Swim, , Water Veil, 1.7, 27, 60, 70, 170, 50, 20, Erratic, Water 1, , 55, 104, 105, 94, 75, 52
368, Gorebyss, , South Sea, Water, , Swift Swim, , Hydration, 1.8, 22.6, 60, 70, 170, 50, 20, Erratic, Water 1, , 55, 84, 105, 114, 75, 52
369, Relicanth, , Longevity, Water, Rock, Swift Swim, Rock Head, Sturdy, 1, 23.4, 25, 70, 170, 87.5, 40, Slow, Water 1, Water 2, 100, 90, 130, 45, 65, 55
370, Luvdisc, , Rendezvous, Water, , Swift Swim, , Hydration, 0.6, 8.7, 225, 70, 116, 25, 20, Fast, Water 2, , 43, 30, 55, 40, 65, 97
371, Bagon, , Rock Head, Dragon, , Rock Head, , Sheer Force, 0.6, 42.1, 45, 35, 60, 50, 40, Slow, Dragon, , 45, 75, 60, 40, 30, 50
372, Shelgon, , Endurance, Dragon, , Rock Head, , Overcoat, 1.1, 110.5, 45, 35, 147, 50, 40, Slow, Dragon, , 65, 95, 100, 60, 50, 50
373, Salamence, , Dragon, Dragon, Flying, Intimidate, , Moxie, 1.5, 102.6, 45, 35, 270, 50, 40, Slow, Dragon, , 95, 135, 80, 110, 80, 100
373, Mega Salamence, m, Dragon, Dragon, Flying, Aerilate, , , 1.8, 112.6, 45, 35, 315, 50, 40, Slow, Dragon, , 95, 145, 130, 120, 90, 120
374, Beldum, , Iron Ball, Steel, Psychic, Clear Body, , Light Metal, 0.6, 95.2, 3, 35, 60, , 40, Slow, Mineral, , 40, 55, 80, 35, 60, 30
375, Metang, , Iron Claw, Steel, Psychic, Clear Body, , Light Metal, 1.2, 202.5, 3, 35, 147, , 40, Slow, Mineral, , 60, 75, 100, 55, 80, 50
376, Metagross, , Iron Leg, Steel, Psychic, Clear Body, , Light Metal, 1.6, 550, 3, 35, 270, , 40, Slow, Mineral, , 80, 135, 130, 95, 90, 70
376, Mega Metagross, m, Iron Leg, Steel, Psychic, Tough Claws, , , 2.5, 942.9, 3, 35, 315, , 40, Slow, Mineral, , 80, 145, 150, 105, 110, 110
377, Regirock, , Rock Peak, Rock, , Clear Body, , Sturdy, 1.7, 230, 3, 35, 261, , 80, Slow, Undiscovered, , 80, 100, 200, 50, 100, 50
378, Regice, , Iceberg, Ice, , Clear Body, , Ice Body, 1.8, 175, 3, 35, 261, , 80, Slow, Undiscovered, , 80, 50, 100, 100, 200, 50
379, Registeel, , Iron, Steel, , Clear Body, , Light Metal, 1.9, 205, 3, 35, 261, , 80, Slow, Undiscovered, , 80, 75, 150, 75, 150, 50
380, Latias, , Eon, Dragon, Psychic, Levitate, , , 1.4, 40, 3, 90, 270, 0, 120, Slow, Undiscovered, , 80, 80, 90, 110, 130, 110
380, Mega Latias, m, Eon, Dragon, Psychic, Levitate, , , 1.8, 52, 3, 90, 315, 0, 120, Slow, Undiscovered, , 80, 100, 120, 140, 150, 110
381, Latios, , Eon, Dragon, Psychic, Levitate, , , 2, 60, 3, 90, 270, 100, 120, Slow, Undiscovered, , 80, 90, 80, 130, 110, 110
381, Mega Latios, m, Eon, Dragon, Psychic, Levitate, , , 2.3, 70, 3, 90, 315, 100, 120, Slow, Undiscovered, , 80, 130, 100, 160, 120, 110
382, Kyogre, , Sea Basin, Water, , Drizzle, , , 4.5, 352, 3, 0, 302, , 120, Slow, Undiscovered, , 100, 100, 90, 150, 140, 90
382, Primal Kyogre, m, Sea Basin, Water, , Primordial Sea, , , 9.8, 430, 5, 0, 347, , 120, Slow, Undiscovered, , 100, 150, 90, 180, 160, 90
383, Groudon, , Continent, Ground, , Drought, , , 3.5, 950, 3, 0, 302, , 120, Slow, Undiscovered, , 100, 150, 140, 100, 90, 90
383, Primal Groudon, m, Continent, Ground, Fire, Desolate Land, , , 5, 999.7, 5, 0, 347, , 120, Slow, Undiscovered, , 100, 180, 160, 150, 90, 90
384, Rayquaza, , Sky High, Dragon, Flying, Air Lock, , , 7, 206.5, 45, 0, 306, , 120, Slow, Undiscovered, , 105, 150, 90, 150, 90, 95
384, Mega Rayquaza, m, Sky High, Dragon, Flying, Delta Stream, , , 10.8, 392, 3, 0, 351, , 120, Slow, Undiscovered, , 105, 180, 100, 180, 100, 115
385, Jirachi, , Wish, Steel, Psychic, Serene Grace, , , 0.3, 1.1, 3, 100, 270, , 120, Slow, Undiscovered, , 100, 100, 100, 100, 100, 100
386, Deoxys Normal Forme, , DNA, Psychic, , Pressure, , , 1.7, 60.8, 3, 0, 270, , 120, Slow, Undiscovered, , 50, 150, 50, 150, 50, 150
386, Deoxys Attack Forme, a, DNA, Psychic, -a, Pressure, , , 1.7, 60.8, 3, 0, 270, , 120, Slow, Undiscovered, , 50, 180, 20, 180, 20, 150
386, Deoxys Defense Forme, d, DNA, Psychic, -d, Pressure, , , 1.7, 60.8, 3, 0, 270, , 120, Slow, Undiscovered, , 50, 70, 160, 70, 160, 90
386, Deoxys Speed Forme, s, DNA, Psychic, -s, Pressure, , , 1.7, 60.8, 3, 0, 270, , 120, Slow, Undiscovered, , 50, 95, 90, 95, 90, 180
387, Turtwig, , Tiny Leaf, Grass, , Overgrow, , Shell Armor, 0.4, 10.2, 45, 70, 64, 87.5, 20, Medium Slow, Grass, Monster, 55, 68, 64, 45, 55, 31
388, Grotle, , Grove, Grass, , Overgrow, , Shell Armor, 1.1, 97, 45, 70, 142, 87.5, 20, Medium Slow, Grass, Monster, 75, 89, 85, 55, 65, 36
389, Torterra, , Continent, Grass, Ground, Overgrow, , Shell Armor, 2.2, 310, 45, 70, 236, 87.5, 20, Medium Slow, Grass, Monster, 95, 109, 105, 75, 85, 56
390, Chimchar, , Chimp, Fire, , Blaze, , Iron Fist, 0.5, 6.2, 45, 70, 62, 87.5, 20, Medium Slow, Field, Human-Like, 44, 58, 44, 58, 44, 61
391, Monferno, , Playful, Fire, Fighting, Blaze, , Iron Fist, 0.9, 22, 45, 70, 142, 87.5, 20, Medium Slow, Field, Human-Like, 64, 78, 52, 78, 52, 81
392, Infernape, , Flame, Fire, Fighting, Blaze, , Iron Fist, 1.2, 55, 45, 70, 240, 87.5, 20, Medium Slow, Field, Human-Like, 76, 104, 71, 104, 71, 108
393, Piplup, , Penguin, Water, , Torrent, , Defiant, 0.4, 5.2, 45, 70, 63, 87.5, 20, Medium Slow, Field, Water 1, 53, 51, 53, 61, 56, 40
394, Prinplup, , Penguin, Water, , Torrent, , Defiant, 0.8, 23, 45, 70, 142, 87.5, 20, Medium Slow, Field, Water 1, 64, 66, 68, 81, 76, 50
395, Empoleon, , Emperor, Water, Steel, Torrent, , Defiant, 1.7, 84.5, 45, 70, 239, 87.5, 20, Medium Slow, Field, Water 1, 84, 86, 88, 111, 101, 60
396, Starly, , Starling, Normal, Flying, Keen Eye, , Reckless, 0.3, 2, 255, 70, 49, 50, 15, Medium Slow, Flying, , 40, 55, 30, 30, 30, 60
397, Staravia, , Starling, Normal, Flying, Intimidate, , Reckless, 0.6, 15.5, 120, 70, 119, 50, 15, Medium Slow, Flying, , 55, 75, 50, 40, 40, 80
398, Staraptor, , Predator, Normal, Flying, Intimidate, , Reckless, 1.2, 24.9, 45, 70, 218, 50, 15, Medium Slow, Flying, , 85, 120, 70, 50, 60, 100
399, Bidoof, , Plump Mouse, Normal, , Simple, Unaware, Moody, 0.5, 20, 255, 70, 50, 50, 15, Medium Fast, Field, Water 1, 59, 45, 40, 35, 40, 31
400, Bibarel, , Beaver, Normal, Water, Simple, Unaware, Moody, 1, 31.5, 127, 70, 144, 50, 15, Medium Fast, Field, Water 1, 79, 85, 60, 55, 60, 71
401, Kricketot, , Cricket, Bug, , Shed Skin, , Run Away, 0.3, 2.2, 255, 70, 39, 50, 15, Medium Slow, Bug, , 37, 25, 41, 25, 41, 25
402, Kricketune, , Cricket, Bug, , Swarm, , Technician, 1, 25.5, 45, 70, 134, 50, 15, Medium Slow, Bug, , 77, 85, 51, 55, 51, 65
403, Shinx, , Flash, Electric, , Rivalry, Intimidate, Guts, 0.5, 9.5, 235, 70, 53, 50, 20, Medium Slow, Field, , 45, 65, 34, 40, 34, 45
404, Luxio, , Spark, Electric, , Rivalry, Intimidate, Guts, 0.9, 30.5, 120, 100, 127, 50, 20, Medium Slow, Field, , 60, 85, 49, 60, 49, 60
405, Luxray, , Gleam Eyes, Electric, , Rivalry, Intimidate, Guts, 1.4, 42, 45, 70, 235, 50, 20, Medium Slow, Field, , 80, 120, 79, 95, 79, 70
406, Budew, , Bud, Grass, Poison, Natural Cure, Poison Point, Leaf Guard, 0.2, 1.2, 255, 70, 56, 50, 20, Medium Slow, Undiscovered, , 40, 30, 35, 50, 70, 55
407, Roserade, , Bouquet, Grass, Poison, Natural Cure, Poison Point, Technician, 0.9, 14.5, 75, 70, 232, 50, 20, Medium Slow, Fairy, Grass, 60, 70, 65, 125, 105, 90
408, Cranidos, , Head Butt, Rock, , Mold Breaker, , Sheer Force, 0.9, 31.5, 45, 70, 70, 87.5, 30, Erratic, Monster, , 67, 125, 40, 30, 30, 58
409, Rampardos, , Head Butt, Rock, , Mold Breaker, , Sheer Force, 1.6, 102.5, 45, 70, 173, 87.5, 30, Erratic, Monster, , 97, 165, 60, 65, 50, 58
410, Shieldon, , Shield, Rock, Steel, Sturdy, , Soundproof, 0.5, 57, 45, 70, 70, 87.5, 30, Erratic, Monster, , 30, 42, 118, 42, 88, 30
411, Bastiodon, , Shield, Rock, Steel, Sturdy, , Soundproof, 1.3, 149.5, 45, 70, 173, 87.5, 30, Erratic, Monster, , 60, 52, 168, 47, 138, 30
412, Burmy, , Bagworm, Bug, , Shed Skin, , Overcoat, 0.2, 3.4, 120, 70, 45, 50, 15, Medium Fast, Bug, , 40, 29, 45, 29, 45, 36
413, Wormadam Plant Cloak, , Bagworm, Bug, Grass, Anticipation, , Overcoat, 0.5, 6.5, 45, 70, 148, 0, 15, Medium Fast, Bug, , 60, 59, 85, 79, 105, 36
413, Wormadam Sandy Cloak, c, Bagworm, Bug, Ground, Anticipation, , Overcoat, 0.5, 6.5, 45, 70, 148, 0, 15, Medium Fast, Bug, , 60, 79, 105, 59, 85, 36
413, Wormadam Trash Cloak, s, Bagworm, Bug, Steel, Anticipation, , Overcoat, 0.5, 6.5, 45, 70, 148, 0, 15, Medium Fast, Bug, , 60, 69, 95, 69, 95, 36
414, Mothim, , Moth, Bug, Flying, Swarm, , Tinted Lens, 0.9, 23.3, 45, 70, 148, 100, 15, Medium Fast, Bug, , 70, 94, 50, 94, 50, 66
415, Combee, , Tiny Bee, Bug, Flying, Honey Gather, , Hustle, 0.3, 5.5, 120, 70, 49, 87.5, 15, Medium Slow, Bug, , 30, 30, 42, 30, 42, 70
416, Vespiquen, , Beehive, Bug, Flying, Pressure, , Unnerve, 1.2, 38.5, 45, 70, 166, 0, 15, Medium Slow, Bug, , 70, 80, 102, 80, 102, 40
417, Pachirisu, , EleSquirrel, Electric, , Run Away, Pickup, Volt Absorb, 0.4, 3.9, 200, 100, 142, 50, 10, Medium Fast, Fairy, Field, 60, 45, 70, 45, 90, 95
418, Buizel, , Sea Weasel, Water, , Swift Swim, , Water Veil, 0.7, 29.5, 190, 70, 66, 50, 20, Medium Fast, Field, Water 1, 55, 65, 35, 60, 30, 85
419, Floatzel, , Sea Weasel, Water, , Swift Swim, , Water Veil, 1.1, 33.5, 75, 70, 173, 50, 20, Medium Fast, Field, Water 1, 85, 105, 55, 85, 50, 115
420, Cherubi, , Cherry, Grass, , Chlorophyll, , , 0.4, 3.3, 190, 70, 55, 50, 20, Medium Fast, Fairy, Grass, 45, 35, 45, 62, 53, 35
421, Cherrim, ~s, Blossom, Grass, , Flower Gift, , , 0.5, 9.3, 75, 70, 158, 50, 20, Medium Fast, Fairy, Grass, 70, 60, 70, 87, 78, 85
422, Shellos, ~e, Sea Slug, Water, , Sticky Hold, Storm Drain, Sand Force, 0.3, 6.3, 190, 70, 65, 50, 20, Medium Fast, Amorphous, Water 1, 76, 48, 48, 57, 62, 34
423, Gastrodon, ~e, Sea Slug, Water, Ground, Sticky Hold, Storm Drain, Sand Force, 0.9, 29.9, 75, 70, 166, 50, 20, Medium Fast, Amorphous, Water 1, 111, 83, 68, 92, 82, 39
424, Ambipom, , Long Tail, Normal, , Technician, Pickup, Skill Link, 1.2, 20.3, 45, 100, 169, 50, 20, Fast, Field, , 75, 100, 66, 60, 66, 115
425, Drifloon, , Balloon, Ghost, Flying, Aftermath, Unburden, Flare Boost, 0.4, 1.2, 125, 70, 70, 50, 30, Fluctuating, Amorphous, , 90, 50, 34, 60, 44, 70
426, Drifblim, , Blimp, Ghost, Flying, Aftermath, Unburden, Flare Boost, 1.2, 15, 60, 70, 174, 50, 30, Fluctuating, Amorphous, , 150, 80, 44, 90, 54, 80
427, Buneary, , Rabbit, Normal, , Run Away, Klutz, Limber, 0.4, 5.5, 190, 0, 70, 50, 20, Medium Fast, Field, Human-Like, 55, 66, 44, 44, 56, 85
428, Lopunny, , Rabbit, Normal, , Cute Charm, Klutz, Limber, 1.2, 33.3, 60, 140, 168, 50, 20, Medium Fast, Field, Human-Like, 65, 76, 84, 54, 96, 105
428, Mega Lopunny, m, Rabbit, Normal, Fighting, Scrappy, , , 1.3, 28.3, 60, 140, 203, 50, 20, Medium Fast, Field, Human-Like, 65, 136, 94, 54, 96, 135
429, Mismagius, , Magical, Ghost, , Levitate, , , 0.9, 4.4, 45, 35, 173, 50, 25, Fast, Amorphous, , 60, 60, 60, 105, 105, 105
430, Honchkrow, , Big Boss, Dark, Flying, Insomnia, Super Luck, Moxie, 0.9, 27.3, 30, 35, 177, 50, 20, Medium Slow, Flying, , 100, 125, 52, 105, 52, 71
431, Glameow, , Catty, Normal, , Limber, Own Tempo, Keen Eye, 0.5, 3.9, 190, 70, 62, 25, 20, Fast, Field, , 49, 55, 42, 42, 37, 85
432, Purugly, , Tiger Cat, Normal, , Thick Fat, Own Tempo, Defiant, 1, 43.8, 75, 70, 158, 25, 20, Fast, Field, , 71, 82, 64, 64, 59, 112
433, Chingling, , Bell, Psychic, , Levitate, , , 0.2, 0.6, 120, 70, 57, 50, 25, Fast, Undiscovered, , 45, 30, 50, 65, 50, 45
434, Stunky, , Skunk, Poison, Dark, Stench, Aftermath, Keen Eye, 0.4, 19.2, 225, 70, 66, 50, 20, Medium Fast, Field, , 63, 63, 47, 41, 41, 74
435, Skuntank, , Skunk, Poison, Dark, Stench, Aftermath, Keen Eye, 1, 38, 60, 70, 168, 50, 20, Medium Fast, Field, , 103, 93, 67, 71, 61, 84
436, Bronzor, , Bronze, Steel, Psychic, Levitate, Heatproof, Heavy Metal, 0.5, 60.5, 255, 70, 60, , 20, Medium Fast, Mineral, , 57, 24, 86, 24, 86, 23
437, Bronzong, , Bronze Bell, Steel, Psychic, Levitate, Heatproof, Heavy Metal, 1.3, 187, 90, 70, 175, , 20, Medium Fast, Mineral, , 67, 89, 116, 79, 116, 33
