438, Bonsly, , Bonsai, Rock, , Sturdy, Rock Head, Rattled, 0.5, 15, 255, 70, 58, 50, 20, Medium Fast, Undiscovered, , 50, 80, 95, 10, 45, 10
439, Mime Jr., , Mime, Psychic, Fairy, Soundproof, Filter, Technician, 0.6, 13, 145, 70, 62, 50, 25, Medium Fast, Undiscovered, , 20, 25, 45, 70, 90, 60
440, Happiny, , Playhouse, Normal, , Natural Cure, Serene Grace, Friend Guard, 0.6, 24.4, 130, 140, 110, 0, 40, Fast, Undiscovered, , 100, 5, 5, 15, 65, 30
441, Chatot, , Music Note, Normal, Flying, Keen Eye, Tangled Feet, Big Pecks, 0.5, 1.9, 30, 35, 144, 50, 20, Medium Slow, Flying, , 76, 65, 45, 92, 42, 91
442, Spiritomb, , Forbidden, Ghost, Dark, Pressure, , Infiltrator, 1, 108, 100, 70, 170, 50, 30, Medium Fast, Amorphous, , 50, 92, 108, 92, 108, 35
443, Gible, , Land Shark, Dragon, Ground, Sand Veil, , Rough Skin, 0.7, 20.5, 45, 70, 60, 50, 40, Slow, Dragon, Monster, 58, 70, 45, 40, 45, 42
444, Gabite, , Cave, Dragon, Ground, Sand Veil, , Rough Skin, 1.4, 56, 45, 70, 144, 50, 40, Slow, Dragon, Monster, 68, 90, 65, 50, 55, 82
445, Garchomp, , Mach, Dragon, Ground, Sand Veil, , Rough Skin, 1.9, 95, 45, 70, 270, 50, 40, Slow, Dragon, Monster, 108, 130, 95, 80, 85, 102
445, Mega Garchomp, m, Mach, Dragon, Ground, Sand Force, , , 1.9, 95, 45, 70, 315, 50, 40, Slow, Dragon, Monster, 108, 170, 115, 120, 95, 92
446, Munchlax, , Big Eater, Normal, , Pickup, Thick Fat, Gluttony, 0.6, 105, 50, 70, 78, 87.5, 40, Slow, Undiscovered, , 135, 85, 40, 40, 85, 5
447, Riolu, , Emanation, Fighting, , Steadfast, Inner Focus, Prankster, 0.7, 20.2, 75, 70, 57, 87.5, 25, Medium Slow, Undiscovered, , 40, 70, 40, 35, 40, 60
448, Lucario, , Aura, Fighting, Steel, Steadfast, Inner Focus, Justified, 1.2, 54, 45, 70, 184, 87.5, 25, Medium Slow, Field, Human-Like, 70, 110, 70, 115, 70, 90
448, Mega Lucario, m, Aura, Fighting, Steel, Adaptability, , , 1.3, 57.5, 45, 70, 219, 87.5, 25, Medium Slow, Field, Human-Like, 70, 145, 88, 140, 70, 112
449, Hippopotas, , Hippo, Ground, , Sand Stream, , Sand Force, 0.8, 49.5, 140, 70, 66, 50, 30, Slow, Field, , 68, 72, 78, 38, 42, 32
450, Hippowdon, , Heavyweight, Ground, , Sand Stream, , Sand Force, 2, 300, 60, 70, 184, 50, 30, Slow, Field, , 108, 112, 118, 68, 72, 47
451, Skorupi, , Scorpion, Poison, Bug, Battle Armor, Sniper, Keen Eye, 0.8, 12, 120, 70, 66, 50, 20, Slow, Bug, Water 3, 40, 50, 90, 30, 55, 65
452, Drapion, , Ogre Scorp, Poison, Dark, Battle Armor, Sniper, Keen Eye, 1.3, 61.5, 45, 70, 175, 50, 20, Slow, Bug, Water 3, 70, 90, 110, 60, 75, 95
453, Croagunk, , Toxic Mouth, Poison, Fighting, Anticipation, Dry Skin, Poison Touch, 0.7, 23, 140, 100, 60, 50, 10, Medium Fast, Human-Like, , 48, 61, 40, 61, 40, 50
454, Toxicroak, , Toxic Mouth, Poison, Fighting, Anticipation, Dry Skin, Poison Touch, 1.3, 44.4, 75, 70, 172, 50, 20, Medium Fast, Human-Like, , 83, 106, 65, 86, 65, 85
455, Carnivine, , Bug Catcher, Grass, , Levitate, , , 1.4, 27, 200, 70, 159, 50, 25, Slow, Grass, , 74, 100, 72, 90, 72, 46
456, Finneon, , Wing Fish, Water, , Swift Swim, Storm Drain, Water Veil, 0.4, 7, 190, 70, 66, 50, 20, Erratic, Water 2, , 49, 49, 56, 49, 61, 66
457, Lumineon, , Neon, Water, , Swift Swim, Storm Drain, Water Veil, 1.2, 24, 75, 70, 161, 50, 20, Erratic, Water 2, , 69, 69, 76, 69, 86, 91
458, Mantyke, , Kite, Water, Flying, Swift Swim, Water Absorb, Water Veil, 1, 65, 25, 70, 69, 50, 25, Slow, Undiscovered, , 45, 20, 50, 60, 120, 50
459, Snover, , Frost Tree, Grass, Ice, Snow Warning, , Soundproof, 1, 50.5, 120, 70, 67, 50, 20, Slow, Grass, Monster, 60, 62, 50, 62, 60, 40
460, Abomasnow, , Frost Tree, Grass, Ice, Snow Warning, , Soundproof, 2.2, 135.5, 60, 70, 173, 50, 20, Slow, Grass, Monster, 90, 92, 75, 92, 85, 60
460, Mega Abomasnow, m, Frost Tree, Grass, Ice, Snow Warning, , , 2.7, 185, 60, 70, 208, 50, 20, Slow, Grass, Monster, 90, 132, 105, 132, 105, 30
461, Weavile, , Sharp Claw, Dark, Ice, Pressure, , Pickpocket, 1.1, 34, 45, 35, 179, 50, 20, Medium Slow, Field, , 70, 120, 65, 45, 85, 125
462, Magnezone, , Magnet Area, Electric, Steel, Magnet Pull, Sturdy, Analytic, 1.2, 180, 30, 70, 241, , 20, Medium Fast, Mineral, , 70, 70, 115, 130, 90, 60
463, Lickilicky, , Licking, Normal, , Own Tempo, Oblivious, Cloud Nine, 1.7, 140, 30, 70, 180, 50, 20, Medium Fast, Monster, , 110, 85, 95, 80, 95, 50
464, Rhyperior, , Drill, Ground, Rock, Lightning Rod, Solid Rock, Reckless, 2.4, 282.8, 30, 70, 241, 50, 20, Slow, Field, Monster, 115, 140, 130, 55, 55, 40
465, Tangrowth, , Vine, Grass, , Chlorophyll, Leaf Guard, Regenerator, 2, 128.6, 30, 70, 187, 50, 20, Medium Fast, Grass, , 100, 100, 125, 110, 50, 50
466, Electivire, , Thunderbolt, Electric, , Motor Drive, , Vital Spirit, 1.8, 138.6, 30, 70, 243, 75, 25, Medium Fast, Human-Like, , 75, 123, 67, 95, 85, 95
467, Magmortar, , Blast, Fire, , Flame Body, , Vital Spirit, 1.6, 68, 30, 70, 243, 75, 25, Medium Fast, Human-Like, , 75, 95, 67, 125, 95, 83
468, Togekiss, , Jubilee, Fairy, Flying, Hustle, Serene Grace, Super Luck, 1.5, 38, 30, 70, 245, 87.5, 10, Fast, Fairy, Flying, 85, 50, 95, 120, 115, 80
469, Yanmega, m, Ogre Darner, Bug, Flying, Speed Boost, Tinted Lens, Frisk, 1.9, 51.5, 30, 70, 180, 50, 20, Medium Fast, Bug, , 86, 76, 86, 116, 56, 95
470, Leafeon, , Verdant, Grass, , Leaf Guard, , Chlorophyll, 1, 25.5, 45, 35, 184, 87.5, 35, Medium Fast, Field, , 65, 110, 130, 60, 65, 95
471, Glaceon, , Fresh Snow, Ice, , Snow Cloak, , Ice Body, 0.8, 25.9, 45, 35, 184, 87.5, 35, Medium Fast, Field, , 65, 60, 110, 130, 95, 65
472, Gliscor, , Fang Scorp, Ground, Flying, Hyper Cutter, Sand Veil, Poison Heal, 2, 42.5, 30, 70, 179, 50, 20, Medium Slow, Bug, , 75, 95, 125, 45, 75, 95
473, Mamoswine, , Twin Tusk, Ice, Ground, Oblivious, Snow Cloak, Thick Fat, 2.5, 291, 50, 70, 239, 50, 20, Slow, Field, , 110, 130, 80, 70, 60, 80
474, Porygon-Z, , Virtual, Normal, , Adaptability, Download, Analytic, 0.9, 34, 30, 70, 241, , 20, Medium Fast, Mineral, , 85, 80, 70, 135, 75, 90
475, Gallade, , Blade, Psychic, Fighting, Steadfast, , Justified, 1.6, 52, 45, 35, 233, 100, 20, Slow, Amorphous, Human-Like, 68, 125, 65, 65, 115, 80
475, Mega Gallade, m, Blade, Psychic, Fighting, Inner Focus, , , 1.6, 56.4, 45, 35, 278, 100, 20, Slow, Amorphous, , 68, 165, 95, 65, 115, 110
476, Probopass, , Compass, Rock, Steel, Sturdy, Magnet Pull, Sand Force, 1.4, 340, 60, 70, 184, 50, 20, Medium Fast, Mineral, , 60, 55, 145, 75, 150, 40
477, Dusknoir, , Gripper, Ghost, , Pressure, , Frisk, 2.2, 106.6, 45, 35, 236, 50, 25, Fast, Amorphous, , 45, 100, 135, 65, 135, 45
478, Froslass, , Snow Land, Ice, Ghost, Snow Cloak, , Cursed Body, 1.3, 26.6, 75, 70, 168, 0, 20, Medium Fast, Fairy, Mineral, 70, 80, 70, 80, 70, 110
479, Rotom, , Plasma, Electric, Ghost, Levitate, , , 0.3, 0.3, 45, 70, 154, , 20, Medium Fast, Amorphous, , 50, 50, 77, 95, 77, 91
479, Heat Rotom, h, Plasma, Electric, Fire, Levitate, , , 0.3, 0.3, 45, 70, 182, , 20, Medium Fast, Amorphous, , 50, 65, 107, 105, 107, 86
479, Wash Rotom, w, Plasma, Electric, Water, Levitate, , , 0.3, 0.3, 45, 70, 182, , 20, Medium Fast, Amorphous, , 50, 65, 107, 105, 107, 86
479, Frost Rotom, f, Plasma, Electric, Ice, Levitate, , , 0.3, 0.3, 45, 70, 182, , 20, Medium Fast, Amorphous, , 50, 65, 107, 105, 107, 86
479, Fan Rotom, s, Plasma, Electric, Flying, Levitate, , , 0.3, 0.3, 45, 70, 182, , 20, Medium Fast, Amorphous, , 50, 65, 107, 105, 107, 86
479, Mow Rotom, m, Plasma, Electric, Grass, Levitate, , , 0.3, 0.3, 45, 70, 182, , 20, Medium Fast, Amorphous, , 50, 65, 107, 105, 107, 86
480, Uxie, , Knowledge, Psychic, , Levitate, , , 0.3, 0.3, 3, 140, 261, , 80, Slow, Undiscovered, , 75, 75, 130, 75, 130, 95
481, Mesprit, , Emotion, Psychic, , Levitate, , , 0.3, 0.3, 3, 140, 261, , 80, Slow, Undiscovered, , 80, 105, 105, 105, 105, 80
482, Azelf, , Willpower, Psychic, , Levitate, , , 0.3, 0.3, 3, 140, 261, , 80, Slow, Undiscovered, , 75, 125, 70, 125, 70, 115
483, Dialga, , Temporal, Steel, Dragon, Pressure, , Telepathy, 5.4, 683, 3, 0, 306, , 120, Slow, Undiscovered, , 100, 120, 120, 150, 100, 90
483, Dialga Origin Forme, o, Temporal, Steel, Dragon, Pressure, , Telepathy, 7, 850, 3, 0, 306, , 120, Slow, Undiscovered, , 100, 100, 120, 150, 120, 90
484, Palkia, , Spatial, Water, Dragon, Pressure, , Telepathy, 4.2, 336, 3, 0, 306, , 120, Slow, Undiscovered, , 90, 120, 100, 150, 120, 100
484, Palkia Origin Forme, o, Spatial, Water, Dragon, Pressure, , Telepathy, 6.3, 660, 3, 0, 306, , 120, Slow, Undiscovered, , 90, 100, 100, 150, 120, 120
485, Heatran, , Lava Dome, Fire, Steel, Flash Fire, , Flame Body, 1.7, 430, 3, 100, 270, 50, 10, Slow, Undiscovered, , 91, 90, 106, 130, 106, 77
486, Regigigas, , Colossal, Normal, , Slow Start, , , 3.7, 420, 3, 0, 302, , 120, Slow, Undiscovered, , 110, 160, 110, 80, 110, 100
487, Giratina, , Renegade, Ghost, Dragon, Pressure, , Telepathy, 4.5, 750, 3, 0, 306, , 120, Slow, Undiscovered, , 150, 100, 120, 100, 120, 90
487, Giratina Origin Forme, o, Renegade, Ghost, Dragon, Levitate, , , 6.9, 650, 3, 0, 306, , 120, Slow, Undiscovered, , 150, 120, 100, 120, 100, 90
488, Cresselia, , Lunar, Psychic, , Levitate, , , 1.5, 85.6, 3, 100, 270, 0, 120, Slow, Undiscovered, , 120, 70, 120, 75, 130, 85
489, Phione, , Sea Drifter, Water, , Hydration, , , 0.4, 3.1, 30, 70, 216, , 40, Slow, Fairy, Water 1, 80, 80, 80, 80, 80, 80
490, Manaphy, , Seafaring, Water, , Hydration, , , 0.3, 1.4, 3, 70, 270, , 10, Slow, Fairy, Water 1, 100, 100, 100, 100, 100, 100
491, Darkrai, , Pitch-Black, Dark, , Bad Dreams, , , 1.5, 50.5, 3, 0, 270, , 120, Slow, Undiscovered, , 70, 90, 90, 135, 90, 125
492, Shaymin, , Gratitude, Grass, , Natural Cure, , , 0.2, 2.1, 45, 100, 270, , 120, Medium Slow, Undiscovered, , 100, 100, 100, 100, 100, 100
492, Shaymin Sky Forme, s, Gratitude, Grass, Flying, Serene Grace, , , 0.4, 5.2, 45, 100, 270, , 120, Medium Slow, Undiscovered, , 100, 103, 75, 120, 75, 127
493, Arceus, types, Alpha, Normal, , Multitype, , , 3.2, 320, 3, 0, 324, , 120, Slow, Undiscovered, , 120, 120, 120, 120, 120, 120
494, Victini, , Victory, Psychic, Fire, Victory Star, , , 0.4, 4, 3, 100, 270, , 120, Slow, Undiscovered, , 100, 100, 100, 100, 100, 100
495, Snivy, , Grass Snake, Grass, , Overgrow, , Contrary, 0.6, 8.1, 45, 70, 62, 87.5, 20, Medium Slow, Field, Grass, 45, 45, 55, 45, 55, 63
496, Servine, , Grass Snake, Grass, , Overgrow, , Contrary, 0.8, 16, 45, 70, 145, 87.5, 20, Medium Slow, Field, Grass, 60, 60, 75, 60, 75, 83
497, Serperior, , Regal, Grass, , Overgrow, , Contrary, 3.3, 63, 45, 70, 238, 87.5, 20, Medium Slow, Field, Grass, 75, 75, 95, 75, 95, 113
498, Tepig, , Fire Pig, Fire, , Blaze, , Thick Fat, 0.5, 9.9, 45, 70, 62, 87.5, 20, Medium Slow, Field, , 65, 63, 45, 45, 45, 45
499, Pignite, , Fire Pig, Fire, Fighting, Blaze, , Thick Fat, 1, 55.5, 45, 70, 146, 87.5, 20, Medium Slow, Field, , 90, 93, 55, 70, 55, 55
500, Emboar, , Mega Fire Pig, Fire, Fighting, Blaze, , Reckless, 1.6, 150, 45, 70, 238, 87.5, 20, Medium Slow, Field, , 110, 123, 65, 100, 65, 65
501, Oshawott, , Sea Otter, Water, , Torrent, , Shell Armor, 0.5, 5.9, 45, 70, 62, 87.5, 20, Medium Slow, Field, , 55, 55, 45, 63, 45, 45
502, Dewott, , Discipline, Water, , Torrent, , Shell Armor, 0.8, 24.5, 45, 70, 145, 87.5, 20, Medium Slow, Field, , 75, 75, 60, 83, 60, 60
503, Samurott, , Formidable, Water, , Torrent, , Shell Armor, 1.5, 94.6, 45, 70, 238, 87.5, 20, Medium Slow, Field, , 95, 100, 85, 108, 70, 70
503, Hisuian Samurott, h, Formidable, Water, Dark, Torrent, , Sharpness, 1.5, 58.2, 45, 70, 238, 87.5, 20, Medium Slow, Field, , 90, 108, 80, 100, 70, 85
504, Patrat, , Scout, Normal, , Run Away, Keen Eye, Analytic, 0.5, 11.6, 255, 70, 51, 50, 15, Medium Fast, Field, , 45, 55, 39, 35, 39, 42
505, Watchog, , Lookout, Normal, , Illuminate, Keen Eye, Analytic, 1.1, 27, 255, 70, 147, 50, 20, Medium Fast, Field, , 60, 85, 69, 60, 69, 77
506, Lillipup, , Puppy, Normal, , Vital Spirit, Pickup, Run Away, 0.4, 4.1, 255, 70, 55, 50, 15, Medium Slow, Field, , 45, 60, 45, 25, 45, 55
507, Herdier, , Loyal Dog, Normal, , Intimidate, Sand Rush, Scrappy, 0.9, 14.7, 120, 70, 130, 50, 15, Medium Slow, Field, , 65, 80, 65, 35, 65, 60
508, Stoutland, , Big-Hearted, Normal, , Intimidate, Sand Rush, Scrappy, 1.2, 61, 45, 70, 225, 50, 15, Medium Slow, Field, , 85, 110, 90, 45, 90, 80
509, Purrloin, , Devious, Dark, , Limber, Unburden, Prankster, 0.4, 10.1, 255, 70, 56, 50, 20, Medium Fast, Field, , 41, 50, 37, 50, 37, 66
510, Liepard, , Cruel, Dark, , Limber, Unburden, Prankster, 1.1, 37.5, 90, 70, 156, 50, 20, Medium Fast, Field, , 64, 88, 50, 88, 50, 106
511, Pansage, , Grass Monkey, Grass, , Gluttony, , Overgrow, 0.6, 10.5, 190, 70, 63, 87.5, 20, Medium Fast, Field, , 50, 53, 48, 53, 48, 64
512, Simisage, , Thorn Monkey, Grass, , Gluttony, , Overgrow, 1.1, 30.5, 75, 70, 174, 87.5, 20, Medium Fast, Field, , 75, 98, 63, 98, 63, 101
513, Pansear, , High Temp, Fire, , Gluttony, , Blaze, 0.6, 11, 190, 70, 63, 87.5, 20, Medium Fast, Field, , 50, 53, 48, 53, 48, 64
514, Simisear, , Ember, Fire, , Gluttony, , Blaze, 1, 28, 75, 70, 174, 87.5, 20, Medium Fast, Field, , 75, 98, 63, 98, 63, 101
515, Panpour, , Spray, Water, , Gluttony, , Torrent, 0.6, 13.5, 190, 70, 63, 87.5, 20, Medium Fast, Field, , 50, 53, 48, 53, 48, 64
516, Simipour, , Geyser, Water, , Gluttony, , Torrent, 1, 29, 75, 70, 174, 87.5, 20, Medium Fast, Field, , 75, 98, 63, 98, 63, 101
517, Munna, , Dream Eater, Psychic, , Forewarn, Synchronize, Telepathy, 0.6, 23.3, 190, 70, 58, 50, 10, Fast, Field, , 76, 25, 45, 67, 55, 24
518, Musharna, , Drowsing, Psychic, , Forewarn, Synchronize, Telepathy, 1.1, 60.5, 75, 70, 170, 50, 10, Fast, Field, , 116, 55, 85, 107, 95, 29
519, Pidove, , Tiny Pigeon, Normal, Flying, Big Pecks, Super Luck, Rivalry, 0.3, 2.1, 255, 70, 53, 50, 15, Medium Slow, Flying, , 50, 55, 50, 36, 30, 43
520, Tranquill, , Wild Pigeon, Normal, Flying, Big Pecks, Super Luck, Rivalry, 0.6, 15, 120, 70, 125, 50, 15, Medium Slow, Flying, , 62, 77, 62, 50, 42, 65
521, Unfezant, , Proud, Normal, Flying, Big Pecks, Super Luck, Rivalry, 1.2, 29, 45, 70, 220, 50, 15, Medium Slow, Flying, , 80, 115, 80, 65, 55, 93
522, Blitzle, , Electrified, Electric, , Lightning Rod, Motor Drive, Sap Sipper, 0.8, 29.8, 190, 70, 59, 50, 20, Medium Fast, Field, , 45, 60, 32, 50, 32, 76
523, Zebstrika, , Thunderbolt, Electric, , Lightning Rod, Motor Drive, Sap Sipper, 1.6, 79.5, 75, 70, 174, 50, 20, Medium Fast, Field, , 75, 100, 63, 80, 63, 116
524, Roggenrola, , Mantle, Rock, , Sturdy, Weak Armor, Sand Force, 0.4, 18, 255, 70, 56, 50, 15, Medium Slow, Mineral, , 55, 75, 85, 25, 25, 15
525, Boldore, , Ore, Rock, , Sturdy, Weak Armor, Sand Force, 0.9, 102, 120, 70, 137, 50, 15, Medium Slow, Mineral, , 70, 105, 105, 50, 40, 20
526, Gigalith, , Compressed, Rock, , Sturdy, Sand Stream, Sand Force, 1.7, 260, 45, 70, 232, 50, 15, Medium Slow, Mineral, , 85, 135, 130, 60, 80, 25
527, Woobat, , Bat, Psychic, Flying, Unaware, Klutz, Simple, 0.4, 2.1, 190, 70, 65, 50, 15, Medium Fast, Field, Flying, 65, 45, 43, 55, 43, 72
528, Swoobat, , Courting, Psychic, Flying, Unaware, Klutz, Simple, 0.9, 10.5, 45, 70, 149, 50, 15, Medium Fast, Field, Flying, 67, 57, 55, 77, 55, 114
529, Drilbur, , Mole, Ground, , Sand Rush, Sand Force, Mold Breaker, 0.3, 8.5, 120, 70, 66, 50, 20, Medium Fast, Field, , 60, 85, 40, 30, 45, 68
530, Excadrill, , Subterrene, Ground, Steel, Sand Rush, Sand Force, Mold Breaker, 0.7, 40.4, 60, 70, 178, 50, 20, Medium Fast, Field, , 110, 135, 60, 50, 65, 88
531, Audino, , Hearing, Normal, , Healer, Regenerator, Klutz, 1.1, 31, 255, 70, 390, 50, 20, Fast, Fairy, , 103, 60, 86, 60, 86, 50
531, Mega Audino, m, Hearing, Normal, Fairy, Healer, , , 1.5, 32, 255, 70, 425, 50, 20, Fast, Fairy, , 103, 60, 126, 80, 126, 50
532, Timburr, , Muscular, Fighting, , Guts, Sheer Force, Iron Fist, 0.6, 12.5, 180, 70, 61, 75, 20, Medium Slow, Human-Like, , 75, 80, 55, 25, 35, 35
533, Gurdurr, , Muscular, Fighting, , Guts, Sheer Force, Iron Fist, 1.2, 40, 90, 70, 142, 75, 20, Medium Slow, Human-Like, , 85, 105, 85, 40, 50, 40
534, Conkeldurr, , Muscular, Fighting, , Guts, Sheer Force, Iron Fist, 1.4, 87, 45, 70, 227, 75, 20, Medium Slow, Human-Like, , 105, 140, 95, 55, 65, 45
535, Tympole, , Tadpole, Water, , Swift Swim, Hydration, Water Absorb, 0.5, 4.5, 255, 70, 59, 50, 20, Medium Slow, Water 1, , 50, 50, 40, 50, 40, 64
536, Palpitoad, , Vibration, Water, Ground, Swift Swim, Hydration, Water Absorb, 0.8, 17, 120, 70, 134, 50, 20, Medium Slow, Water 1, , 75, 65, 55, 65, 55, 69
537, Seismitoad, , Vibration, Water, Ground, Swift Swim, Poison Touch, Water Absorb, 1.5, 62, 45, 70, 229, 50, 20, Medium Slow, Water 1, , 105, 95, 75, 85, 75, 74
538, Throh, , Judo, Fighting, , Guts, Inner Focus, Mold Breaker, 1.3, 55.5, 45, 70, 163, 100, 20, Medium Fast, Human-Like, , 120, 100, 85, 30, 85, 45
539, Sawk, , Karate, Fighting, , Sturdy, Inner Focus, Mold Breaker, 1.4, 51, 45, 70, 163, 100, 20, Medium Fast, Human-Like, , 75, 125, 75, 30, 75, 85
540, Sewaddle, , Sewing, Bug, Grass, Swarm, Chlorophyll, Overcoat, 0.3, 2.5, 255, 70, 62, 50, 15, Medium Slow, Bug, , 45, 53, 70, 40, 60, 42
541, Swadloon, , Leaf-Wrapped, Bug, Grass, Leaf Guard, Chlorophyll, Overcoat, 0.5, 7.3, 120, 70, 133, 50, 15, Medium Slow, Bug, , 55, 63, 90, 50, 80, 42
542, Leavanny, , Nurturing, Bug, Grass, Swarm, Chlorophyll, Overcoat, 1.2, 20.5, 45, 70, 225, 50, 15, Medium Slow, Bug, , 75, 103, 80, 70, 80, 92
543, Venipede, , Centipede, Bug, Poison, Poison Point, Swarm, Speed Boost, 0.4, 5.3, 255, 70, 52, 50, 15, Medium Slow, Bug, , 30, 45, 59, 30, 39, 57
544, Whirlipede, , Curlipede, Bug, Poison, Poison Point, Swarm, Speed Boost, 1.2, 58.5, 120, 70, 126, 50, 15, Medium Slow, Bug, , 40, 55, 99, 40, 79, 47
545, Scolipede, , Megapede, Bug, Poison, Poison Point, Swarm, Speed Boost, 2.5, 200.5, 45, 70, 218, 50, 20, Medium Slow, Bug, , 60, 100, 89, 55, 69, 112
546, Cottonee, , Cotton Puff, Grass, Fairy, Prankster, Infiltrator, Chlorophyll, 0.3, 0.6, 190, 70, 56, 50, 20, Medium Fast, Fairy, Grass, 40, 27, 60, 37, 50, 66
547, Whimsicott, , Windveiled, Grass, Fairy, Prankster, Infiltrator, Chlorophyll, 0.7, 6.6, 75, 70, 168, 50, 20, Medium Fast, Fairy, Grass, 60, 67, 85, 77, 75, 116
548, Petilil, , Bulb, Grass, , Chlorophyll, Own Tempo, Leaf Guard, 0.5, 6.6, 190, 70, 56, 0, 20, Medium Fast, Grass, , 45, 35, 50, 70, 50, 30
549, Lilligant, , Flowering, Grass, , Chlorophyll, Own Tempo, Leaf Guard, 1.1, 16.3, 75, 70, 168, 0, 20, Medium Fast, Grass, , 70, 60, 75, 110, 75, 90
549, Hisuian Lilligant, h, Flowering, Grass, Fighting, Chlorophyll, Hustle, Leaf Guard, 1.2, 19.2, 75, 70, 168, 0, 20, Medium Fast, Grass, , 70, 105, 75, 50, 75, 105
550, Basculin Red-Striped, , Hostile, Water, , Reckless, Adaptability, Mold Breaker, 1, 18, 25, 70, 161, 50, 40, Medium Fast, Water 2, , 70, 92, 65, 80, 55, 98
550, Basculin Blue-Striped, b, Hostile, Water, , Rock Head, Adaptability, Mold Breaker, 1, 18, 25, 70, 161, 50, 40, Medium Fast, Water 2, , 70, 92, 65, 80, 55, 98
550, Basculin White-Striped, w, Hostile, Water, , Rattled, Adaptability, Mold Breaker, 1, 18, 25, 70, 161, 50, 40, Medium Fast, Water 2, , 70, 92, 65, 80, 55, 98
551, Sandile, , Desert Croc, Ground, Dark, Intimidate, Moxie, Anger Point, 0.7, 15.2, 180, 70, 58, 50, 20, Medium Slow, Field, , 50, 72, 35, 35, 35, 65
552, Krokorok, , Desert Croc, Ground, Dark, Intimidate, Moxie, Anger Point, 1, 33.4, 90, 70, 123, 50, 20, Medium Slow, Field, , 60, 82, 45, 45, 45, 74
553, Krookodile, , Intimidation, Ground, Dark, Intimidate, Moxie, Anger Point, 1.5, 96.3, 45, 70, 234, 50, 20, Medium Slow, Field, , 95, 117, 80, 65, 70, 92
554, Darumaka, , Zen Charm, Fire, , Hustle, , Inner Focus, 0.6, 37.5, 120, 70, 63, 50, 20, Medium Slow, Field, , 70, 90, 45, 15, 45, 50
554, Galarian Darumaka, g, Zen Charm, Ice, , Hustle, , Inner Focus, 0.7, 40, 120, 70, 63, , 20, Medium Slow, Field, , 70, 90, 45, 15, 45, 50
555, Darmanitan, , Blazing, Fire, , Sheer Force, , Zen Mode, 1.3, 92.9, 60, 70, 168, 50, 20, Medium Slow, Field, , 105, 140, 55, 30, 55, 95
555, Darmanitan Zen Mode, z, Blazing, Fire, Psychic, Sheer Force, , Zen Mode, 1.3, 92.9, 60, 70, 189, 50, 20, Medium Slow, Field, , 105, 30, 105, 140, 105, 55
555, Galarian Darmanitan, g, Zen Charm, Ice, , Gorilla Tactics, , Zen Mode, 1.7, 120, 60, 70, 189, 50, 20, Medium Slow, Field, , 105, 140, 55, 30, 55, 95
555, Galarian Darmanitan Zen Mode, gz, Zen Charm, Ice, Fire, Gorilla Tactics, , Zen Mode, 1.7, 120, 60, 70, 189, 50, 20, Medium Slow, Field, , 105, 160, 55, 30, 55, 135
556, Maractus, , Cactus, Grass, , Water Absorb, Chlorophyll, Storm Drain, 1, 28, 255, 70, 161, 50, 20, Medium Fast, Grass, , 75, 86, 67, 106, 67, 60
557, Dwebble, , Rock Inn, Bug, Rock, Sturdy, Shell Armor, Weak Armor, 0.3, 14.5, 190, 70, 65, 50, 20, Medium Fast, Bug, Mineral, 50, 65, 85, 35, 35, 55
558, Crustle, , Stone Home, Bug, Rock, Sturdy, Shell Armor, Weak Armor, 1.4, 200, 75, 70, 170, 50, 20, Medium Fast, Bug, Mineral, 70, 105, 125, 65, 75, 45
559, Scraggy, , Shedding, Dark, Fighting, Shed Skin, Moxie, Intimidate, 0.6, 11.8, 180, 35, 70, 50, 15, Medium Fast, Dragon, Field, 50, 75, 70, 35, 70, 48
560, Scrafty, , Hoodlum, Dark, Fighting, Shed Skin, Moxie, Intimidate, 1.1, 30, 90, 70, 171, 50, 15, Medium Fast, Dragon, Field, 65, 90, 115, 45, 115, 58
561, Sigilyph, , Avianoid, Psychic, Flying, Wonder Skin, Magic Guard, Tinted Lens, 1.4, 14, 45, 70, 172, 50, 20, Medium Fast, Flying, , 72, 58, 80, 103, 80, 97
562, Yamask, , Spirit, Ghost, , Mummy, , , 0.5, 1.5, 190, 70, 61, 50, 25, Medium Fast, Amorphous, Mineral, 38, 30, 85, 55, 65, 30
562, Galarian Yamask, g, Spirit, Ground, Ghost, Wandering Spirit, , , 0.5, 1.5, 190, 70, 61, , 25, Medium Fast, Amorphous, Mineral, 38, 55, 85, 30, 65, 30
563, Cofagrigus, , Coffin, Ghost, , Mummy, , , 1.7, 76.5, 90, 70, 169, 50, 25, Medium Fast, Amorphous, Mineral, 58, 50, 145, 95, 105, 30
564, Tirtouga, , Prototurtle, Water, Rock, Solid Rock, Sturdy, Swift Swim, 0.7, 16.5, 45, 70, 71, 87.5, 30, Medium Fast, Water 1, Water 3, 54, 78, 103, 53, 45, 22
565, Carracosta, , Prototurtle, Water, Rock, Solid Rock, Sturdy, Swift Swim, 1.2, 81, 45, 70, 173, 87.5, 30, Medium Fast, Water 1, Water 3, 74, 108, 133, 83, 65, 32
566, Archen, , First Bird, Rock, Flying, Defeatist, , , 0.5, 9.5, 45, 70, 71, 87.5, 30, Medium Fast, Flying, Water 3, 55, 112, 45, 74, 45, 70
567, Archeops, , First Bird, Rock, Flying, Defeatist, , , 1.4, 32, 45, 70, 177, 87.5, 30, Medium Fast, Flying, Water 3, 75, 140, 65, 112, 65, 110
568, Trubbish, , Trash Bag, Poison, , Stench, Sticky Hold, Aftermath, 0.6, 31, 190, 70, 66, 50, 20, Medium Fast, Mineral, , 50, 50, 62, 40, 62, 65
569, Garbodor, , Trash Heap, Poison, , Stench, Weak Armor, Aftermath, 1.9, 107.3, 60, 70, 166, 50, 20, Medium Fast, Mineral, , 80, 95, 82, 60, 82, 75
570, Zorua, , Tricky Fox, Dark, , Illusion, , , 0.7, 12.5, 75, 70, 66, 87.5, 25, Medium Slow, Field, , 40, 65, 40, 80, 40, 65
570, Hisuian Zorua, h, Tricky Fox, Normal, Ghost, Illusion, , , 0.7, 12.5, 75, 70, 66, 87.5, 25, Medium Slow, Field, , 35, 60, 40, 85, 40, 70
571, Zoroark, , Illusion Fox, Dark, , Illusion, , , 1.6, 81.1, 45, 70, 179, 87.5, 20, Medium Slow, Field, , 60, 105, 60, 120, 60, 105
571, Hisuian Zoroark, h, Illusion Fox, Normal, Ghost, Illusion, , , 1.6, 73, 45, 70, 179, 87.5, 20, Medium Slow, Field, , 55, 100, 60, 125, 60, 110
572, Minccino, , Chinchilla, Normal, , Cute Charm, Technician, Skill Link, 0.4, 5.8, 255, 70, 60, 25, 15, Fast, Field, , 55, 50, 40, 40, 40, 75
573, Cinccino, , Scarf, Normal, , Cute Charm, Technician, Skill Link, 0.5, 7.5, 60, 70, 165, 25, 15, Fast, Field, , 75, 95, 60, 65, 60, 115
574, Gothita, , Fixation, Psychic, , Frisk, Competitive, Shadow Tag, 0.4, 5.8, 200, 70, 58, 25, 20, Medium Slow, Human-Like, , 45, 30, 50, 55, 65, 45
575, Gothorita, , Manipulate, Psychic, , Frisk, Competitive, Shadow Tag, 0.7, 18, 100, 70, 137, 25, 20, Medium Slow, Human-Like, , 60, 45, 70, 75, 85, 55
576, Gothitelle, , Astral Body, Psychic, , Frisk, Competitive, Shadow Tag, 1.5, 44, 50, 70, 221, 25, 20, Medium Slow, Human-Like, , 70, 55, 95, 95, 110, 65
577, Solosis, , Cell, Psychic, , Overcoat, Magic Guard, Regenerator, 0.3, 1, 200, 70, 58, 50, 20, Medium Slow, Amorphous, , 45, 30, 40, 105, 50, 20
578, Duosion, , Mitosis, Psychic, , Overcoat, Magic Guard, Regenerator, 0.6, 8, 100, 70, 130, 50, 20, Medium Slow, Amorphous, , 65, 40, 50, 125, 60, 30
579, Reuniclus, , Multiplying, Psychic, , Overcoat, Magic Guard, Regenerator, 1, 20.1, 50, 70, 221, 50, 20, Medium Slow, Amorphous, , 110, 65, 75, 125, 85, 30
580, Ducklett, , Water Bird, Water, Flying, Keen Eye, Big Pecks, Hydration, 0.5, 5.5, 190, 70, 61, 50, 20, Medium Fast, Flying, Water 1, 62, 44, 50, 44, 50, 55
581, Swanna, , White Bird, Water, Flying, Keen Eye, Big Pecks, Hydration, 1.3, 24.2, 45, 70, 166, 50, 20, Medium Fast, Flying, Water 1, 75, 87, 63, 87, 63, 98
582, Vanillite, , Fresh Snow, Ice, , Ice Body, Snow Cloak, Weak Armor, 0.4, 5.7, 255, 70, 61, 50, 20, Slow, Mineral, , 36, 50, 50, 65, 60, 44
583, Vanillish, , Icy Snow, Ice, , Ice Body, Snow Cloak, Weak Armor, 1.1, 41, 120, 70, 138, 50, 20, Slow, Mineral, , 51, 65, 65, 80, 75, 59
584, Vanilluxe, , Snowstorm, Ice, , Ice Body, Snow Warning, Weak Armor, 1.3, 57.5, 45, 70, 241, 50, 20, Slow, Mineral, , 71, 95, 85, 110, 95, 79
585, Deerling, ~s~a~w, Season, Normal, Grass, Chlorophyll, Sap Sipper, Serene Grace, 0.6, 19.5, 190, 70, 67, 50, 20, Medium Fast, Field, , 60, 60, 50, 40, 50, 75
586, Sawsbuck, ~s~a~w, Season, Normal, Grass, Chlorophyll, Sap Sipper, Serene Grace, 1.9, 92.5, 75, 70, 166, 50, 20, Medium Fast, Field, , 80, 100, 70, 60, 70, 95
587, Emolga, , Sky Squirrel, Electric, Flying, Static, , Motor Drive, 0.4, 5, 200, 70, 150, 50, 20, Medium Fast, Field, , 55, 75, 60, 75, 60, 103
588, Karrablast, , Clamping, Bug, , Swarm, Shed Skin, No Guard, 0.5, 5.9, 200, 70, 63, 50, 15, Medium Fast, Bug, , 50, 75, 45, 40, 45, 60
589, Escavalier, , Cavalry, Bug, Steel, Swarm, Shell Armor, Overcoat, 1, 33, 75, 70, 173, 50, 15, Medium Fast, Bug, , 70, 135, 105, 60, 105, 20
